{
  "schemaVersion": 1,
  "id": "wallet-event-fork",
  "name": "Wallet event missing on one relay",
  "description": "One relay withholds the kind:17375 wallet event; applications reading only that relay do not recognize the wallet at all while balances are intact elsewhere.",
  "expect": {
    "codes": ["WALLET_EVENT_FORK"],
    "ok": false,
    "merged": 16,
    "mintVerified": 16
  },
  "commands": [
    {
      "op": "mint",
      "amount": 16
    },
    {
      "op": "relay-partition",
      "relay": 1,
      "kinds": [17375]
    }
  ]
}
